,recipe_name,serving_size,cooking_time,difficulty,ingredients,recipe_url
687,"Tray-baked lamb with aubergines, tomatoes, olives, garlic and mint oil",serves 4,55 mins plus resting time,1,"['2 x 7-rib racks of lamb, preferably organic, French-trimmed', '2 firm aubergines', '8 ripe plum tomatoes', 'extra virgin olive oil', '8 cloves of garlic, skin left on', 'dried oregano', 'sea salt and freshly ground black pepper', 'optional: fresh basil or marjoram', '1 handful of olives, destoned', '1 large handful of fresh mint', 'a pinch of sugar', 'good red wine vinegar']",https://www.jamieoliver.com/recipes/lamb/tray-baked-lamb-with-aubergines-tomatoes-olives-garlic-and-mint-oil/
688,Toad in the hole,serves 4,50 mins,3,"['sunflower oil', '8 higher-welfare sausages', '4 sprigs of fresh rosemary', '2 large red onions', '2 cloves of garlic', '2 knobs of unsalted butter', '6 tablespoons balsamic vinegar', '1 level tablespoon vegetable stock powder or 1 organic vegetable stock cube', '285ml milk', '115g plain flour', '3 large free-range eggs']",https://www.jamieoliver.com/recipes/pork/classic-toad-in-the-hole/
689,Three cheese risotto,serves 6,55 mins plus resting time,1,"['1 litre hot organic chicken or vegetable stock', '1 tablespoon olive oil', '2 medium onions, peeled and finely chopped', '2 cloves garlic, peeled and finely chopped', '3 sticks celery, trimmed and finely chopped', '400g risotto rice', '2 glasses of dry white wine', 'sea salt and freshly ground black pepper', '75g Appenzeller or Gruyere cheese, roughly chopped', '75g Taleggio cheese, roughly chopped', 'a knob of butter', '40g freshly grated Parmesan cheese']",https://www.jamieoliver.com/recipes/rice/three-cheese-risotto/
690,The real mushroom soup,serves 6,1 hr,1,"['a small handful of dried porcini', 'olive oil', '600g mixed fresh wild mushrooms (chanterelles, girolles, trompettes de mort, shiitake, oyster), cleaned and sliced', '2 cloves of garlic, peeled and finely sliced', '1 red onion, peeled and finely chopped', 'a handful of fresh thyme, leaves picked', 'sea salt and freshly ground black pepper', '1 litre chicken or vegetable stock, preferably organic', 'a handful of fresh flat-leaf parsley, leaves picked and roughly chopped', '1 tablespoon mascarpone cheese', '1 lemon', 'optional: truffle oil']",https://www.jamieoliver.com/recipes/vegetables/the-real-mushroom-soup/
691,The nicest tray-baked lemon sole,serves 4,35 mins plus resting time,1,"['. 4 whole lemon soles', '. 2 handfuls of red and yellow cherry tomatoes, halved', '. 4 cloves of garlic, peeled and finely sliced', '. a handful of fresh oregano or basil, leaves picked', '. a bunch of spring onions, trimmed and finely sliced', '. 1 tablespoon balsamic vinegar', '. sea salt and freshly ground black pepper', '. 2 lemons, zested and halved', '. extra virgin olive oil', '. a handful of black olives, destoned and chopped', '. a handful of fresh flat-leaf parsley, finely chopped']",https://www.jamieoliver.com/recipes/fish/the-nicest-tray-baked-lemon-sole/
692,The best turkey in the world,serves 10,4 hrs 55 mins plus resting time,3,,https://www.jamieoliver.com/recipes/turkey/the-best-turkey-in-the-world/
693,The best tuna meatballs (Le migliori polpette di tonno),serves 4,55 mins plus resting time,1,"['for the tomato sauce', 'olive oil', '1 small onion, peeled and finely chopped', '4 cloves of garlic, peeled and finely sliced', '1 teaspoon dried oregano', '2 x 400g tins of good-quality plum tomatoes', 'sea salt and freshly ground black pepper', 'red wine vinegar', 'a small bunch of fresh flat-leaf parsley, leaves picked and roughly chopped', 'for the meatballs', '400g/14oz sustainably sourced tuna', 'olive oil', '55g/2oz pine nuts', '1 level teaspoon ground cinnamon', 'sea salt and freshly ground black pepper', '1 teaspoon dried oregano', 'a handful of fresh flat-leaf parsley, chopped', '100g/3½oz stale breadcrumbs', '25g/1oz freshly grated Parmesan', '2 eggs', '1 lemon']",https://www.jamieoliver.com/recipes/fish/the-best-tuna-meatballs-le-migliori-polpette-di-tonno/
694,The best tuna burger,serves 4,25 mins plus chilling,1,"['1 sprig of fresh basil', '1 sprig of fresh mint', '4 spring onions', '1 fresh red chilli', '1 lemon', '600g fresh tuna steak, from sustainable sources', '1 pinch of ground coriander', 'olive oil', '½ a round lettuce', '1 handful of rocket leaves', '2 ripe tomatoes', '4 ciabatta rolls or burger buns', 'tomato ketchup or salsa verde']",https://www.jamieoliver.com/recipes/fish/the-best-tuna-burger/
695,The best roast turkey - Christmas or any time,serves 8,3 hrs 40 mins plus cooling and resting ,5,"['a sprig of fresh sage, leaves picked', '12 strips of pancetta or thinly sliced streaky bacon', '1 bulb of garlic, broken into cloves', '4 medium red onions, peeled', '2 sticks of celery, trimmed and chopped', 'a big handful of breadcrumbs', 'a handful of dried apricots', '300g/10½ oz minced pork', 'zest of 1 lemon', 'a pinch of grated nutmeg', '1 large free-range or organic egg', 'sea salt and freshly ground black pepper', '12 small fresh rosemary sprigs, plus a few extra', '4–4.5kg/9–10lb turkey, preferably free-range or organic, at room temperature', '2 carrots, peeled', '1 large orange', 'olive oil', '2 tablespoons plain flour', '1.1litres/2 pints chicken or vegetable stock']",https://www.jamieoliver.com/recipes/turkey/the-best-roast-turkey-christmas-or-any-time/
696,"The best pork chops with fresh bay salt, crackling and squashed purple potatoes",serves 4,45 mins,1,"['1kg/2¼lb purple or Desirée potatoes, peeled and halved', 'sea salt and freshly ground black pepper', '4 pork chops, skin removed but kept', 'extra virgin olive oil', '1 small handful of fresh thyme, leaves picked', '1 teaspoon fennel seeds', '10 bay leaves', '285ml (½ pint) cider', '1 tablespoon wholegrain mustard', '4 tablespoons low fat crème fraîche', 'a knob of butter']",https://www.jamieoliver.com/recipes/pork/the-best-pork-chops-with-fresh-bay-salt-crackling-and-squashed-purple-potatoes/
697,The best pasta salad,serves 4,15 mins,1,"['310g/11oz small shell-shaped pasta', '3 cloves of garlic', '255g/9oz yellow cherry tomatoes', '255g/9oz red cherry tomatoes', '1 handful of black olives, pitted', '2 tablespoons fresh chives', '1 handful of fresh basil', '½ a cucumber', '4 tablespoons white wine vinegar, or to taste', '7 tablespoons extra virgin olive oil', 'sea salt and freshly ground black pepper']",https://www.jamieoliver.com/recipes/pasta/the-best-pasta-salad/
698,The best baked pumpkin,serves 4,1 hr 30 mins,3,"['1 pumpkin (about 1 kg)', '2 cloves of garlic, peeled', 'olive oil', '1 red onion, peeled and finely chopped', 'a small handful of black olives, stoned and chopped', '2 sprigs of fresh rosemary, leaves finely chopped', '1 dried chilli', 'sea salt and freshly ground black pepper', '½ teaspoon ground nutmeg', '½ teaspoon ground cinnamon', '50g basmati rice, washed and drained', '75g dried cranberries', '50g shelled pistachio nuts', 'zest of 1 tangerine', '200ml organic vegetable stock']",https://www.jamieoliver.com/recipes/vegetables/the-best-baked-pumpkin/
699,"Tapas feast: tortilla, glazed chorizo, Manchego cheese, cured meats & honey, stuffed peppers, rolled anchovies",serves 6,30 mins,1,"['250g baby new potatoes', '1 small red onion', '1 teaspoon fennel seeds', '2 cloves of garlic', '½ a small bunch of fresh rosemary', '8 large free-range eggs', 'a large handful of prewashed rocket, to serve', '250g semi-cured whole iberico chorizo', '2 cloves of garlic', '4 tablespoons red wine vinegar', '1 tablespoon runny honey', '50g Manchego cheese', '1 ciabatta loaf', '50g blanched almonds', 'a small bunch of fresh thyme', 'red wine vinegar', '1 x 450g jar of whole peppers', '100g Manchego cheese', '100g quality Spanish cured meats, such as pata negra', 'runny honey, for drizzling', 'instant or quality ground coffee', 'a handful of black olives', 'optional: a couple of sprigs of fresh thyme or oregano', '½ x 100g pack of marinated or dressed anchovies, from chilled section, from sustainable sources', 'a few sprigs of fresh flat-leaf parsley', '1 lemon', '150g cherry tomatoes', 'smoked paprika, for dusting', 'olive oil', 'extra virgin olive oil', 'sea salt & black pepper', 'a bottle of sparkling water', '1 orange', 'a chilled bottle of dry sherry']",https://www.jamieoliver.com/recipes/pork/tapas-feast-tortilla-glazed-chorizo-manchego-cheese-cured-meats-honey-stuffed-peppers-rolled-anchovies/
700,Taglierini with a simple sweet tomato sauce and shrimps,serves 4,30 mins,1,"['8 plum tomatoes', 'sea salt and freshly ground black pepper', 'extra virgin olive oil', '300g (10½oz) small peeled prawns or shrimps', '1 clove of garlic, peeled and finely chopped', 'zest and juice of 1 lemon', '2 shots of Vecchia Romana or Cognac', '142ml pot single cream', '400g/14oz fresh or dried taglierini', '1 large handful of fresh parsley, roughly chopped']",https://www.jamieoliver.com/recipes/pasta/taglierini-with-a-simple-sweet-tomato-sauce-and-shrimps/
701,"Tagliatelle with spinach, mascarpone and Parmesan",serves 4,25 mins,1,"['455g/1lb tagliatelle or spaghetti', 'olive oil', '2 teaspoons butter', '2 cloves of garlic, peeled and sliced', '½ a nutmeg, freshly grated', '400g/14oz fresh spinach, washed thoroughly and finely sliced', 'sea salt and freshly ground black pepper', '120ml/4fl oz double cream', '150g/5oz mascarpone cheese', '2 handfuls of freshly grated Parmesan cheese']",https://www.jamieoliver.com/recipes/pasta/tagliatelle-with-spinach-mascarpone-and-parmesan/
702,"Tagliatelle with asparagus, crispy pancetta and Parmesan",serves 4,30 mins,1,"['1 bunch asparagus', '12 thin slices higher welfare pancetta, sliced into small strips', '500g fresh egg tagliatelle', '40g Parmesan, grated', 'sea salt and freshly ground black pepper', 'extra virgin olive oil']",https://www.jamieoliver.com/recipes/pasta/tagliatelle-with-asparagus-crispy-pancetta-and-parmesan/
703,Sweet duck legs cooked with plums and star anise,serves 4,2 hrs 35 mins plus marinating time,1,"['4 fat legs of duck', '4 tablespoons soy sauce', '3 teaspoons five-spice', 'a handful of star anise', '½ a stick of cinnamon', '1 tablespoon olive oil', '1–2 fresh chillies, deseeded and sliced', '16 plums, halved and destoned', '2 tablespoons Demerara sugar']",https://www.jamieoliver.com/recipes/duck/sweet-duck-legs-cooked-with-plums-and-star-anise/
704,Sweet cherry tomato and sausage bake,serves 6,1 hr 15 mins,1,"['2kg lovely ripe cherry tomatoes, mixed colours if you can find them', '2 sprigs each of fresh thyme, rosemary and bay', '1 tablespoon dried oregano', '3 cloves of garlic, peeled and chopped', '12 good-quality Cumberland or coarse Italian pork sausages', 'extra virgin olive oil', 'balsamic vinegar']",https://www.jamieoliver.com/recipes/pork/sweet-cherry-tomato-and-sausage-bake/
705,Surf & turf gumbo,serves 10,1 hr 15 mins,1,"['16–20 raw king prawns, preferably shell on, from sustainable sources', 'olive oil', '500g quality spicy cured sausage, sliced into 1cm rounds', '3 litres organic chicken stock', '5 heaped tablespoons plain flour', '1 large onion, peeled and finely chopped', '2 large green peppers, deseeded and finely chopped', '3 stalks of celery, trimmed and finely chopped', '5 fresh bay leaves', '½ a bunch of fresh thyme (15g), leaves picked', '8 cloves of garlic, peeled and finely chopped', '1 teaspoon cayenne pepper', '1 teaspoon Tabasco sauce', '200g okra, sliced into rounds', '300g picked crabmeat, plus 4 claws (if you can get hold of them)', '1 x 400g tin of chopped tomatoes', 'juice of 1 lemon', '½ a bunch of fresh curly parsley (15g)']",https://www.jamieoliver.com/recipes/pork/surf-turf-gumbo/
706,Super tasty Spanish roast chicken,serves 8,1 hr 40 mins,1,"['1.6kg potatoes, peeled and cut into 2.5cm dice', '4 lemons', 'a handful of fresh flat-leaf parsley', '1 x 2kg free-range organic chicken', 'sea salt and freshly ground black pepper', '300g good chorizo sausage', 'olive oil', '2 cloves of garlic, peeled and finely chopped']",https://www.jamieoliver.com/recipes/chicken/super-tasty-spanish-roast-chicken/
707,Summertime tagliarini,serves 4,30 mins,1,"['75g pine nuts', 'juice and zest of 2 lemons', '1 bunch of fresh flat-leaf parsley (30g), leaves picked, half finely chopped and half left whole', '135ml extra virgin olive oil', '95g Parmesan cheese, freshly grated, plus extra for shaving', '30g pecorino cheese, freshly grated', '320g good-quality tagliarini or tagliatelle']",https://www.jamieoliver.com/recipes/pasta/summertime-tagliarini/
708,Stuffed sea bass,serves 2,50 mins,3,"['2 whole sea bass (cleaned and gutted) – head and tail on', '1 whole fennel', '1 teaspoon fennel seeds', '2 garlic cloves', '50ml olive oil', '35g butter', '½ a bunch Dill fresh', '½ a bunch Parsley flat leaf', '½ a bunch Basil fresh', '½ a bunch Mint fresh', '10 baby potatoes', '20 capers', '1 lemon', '200ml white wine', '200g tomato and basil sauce']",https://www.jamieoliver.com/recipes/fish/stuffed-sea-bass/
709,Stir-fried duck with sugar snap peas and asparagus,serves 4,30 mins,1,"['4 x 200g/7oz duck breasts', '2 teaspoons five-spice', 'sea salt and freshly ground black pepper', '2 tablespoons sunflower or groundnut oil', '2 large handfuls of thin asparagus, trimmed', '2 large handfuls of sugar snap peas or mangetouts', '4 cloves of garlic, finely sliced', '1–3 fresh red chillies, deseeded and finely sliced 2 thumb-sized pieces of fresh ginger, peeled and grated', '4 oranges, zested and segmented', '1 tablespoon honey', 'a handful of fresh mint, leaves picked', '3 tablespoons low salt soy sauce']",https://www.jamieoliver.com/recipes/duck/stir-fried-duck-with-sugar-snap-peas-and-asparagus/
710,Steamed Thai-style sea bass and rice,serves 4,40 mins,1,"['For the Thai paste', '2 large bunches of fresh coriander, leaves picked and stalks reserved', '2 thumb-sized pieces of fresh ginger, peeled', '3 cloves of garlic, peeled', '2 fresh red chillies, halved and deseeded', '2 teaspoons sesame oil', '6 tablespoons soy sauce', 'juice and zest of 2 limes', '1 x 400ml tin reduced fat coconut milk', 'For the sea bass and rice.', '400g/14oz basmati rice', 'sea salt and freshly ground black pepper', '4 x 170g/6oz sea bass fillets, from sustainable sources, pinboned and skin scored', 'a handful of sugar snap peas or mangetouts', 'a bunch of spring onions, outer leaves discarded, trimmed and finely sliced', '1–2 fresh red chillies, deseeded and finely sliced', '1 lime, quartered']",https://www.jamieoliver.com/recipes/fish/steamed-thai-style-sea-bass-and-rice/
711,Steamed Asian sea bass in the bag,serves 2,30 mins plus optional marinating time,1,"['6 lime leaves', '1–2 sticks lemon grass, chopped', '1 clove of garlic, finely sliced', '1–2 red chillies, to taste, seeded and chopped', 'a small tablespoon of freshly grated ginger', 'a handful of coriander, leaves picked and stalks reserved, plus extra to serve', '1 tablespoon Kikkoman low-salt soy sauce', '1 lime, zested and halved', '2 tablespoons olive oil', '2 nice thick fillets of sea bass, from sustainable sources, ask your fishmonger – about 200g each', '1 free-range egg white', 'a small wine glass of sake']",https://www.jamieoliver.com/recipes/fish/steamed-asian-sea-bass-in-the-bag/
712,"Steak, Guinness & cheese pie",serves 6,3 hrs 50 mins,3,"['3 red onions', '3 cloves of garlic', '2 carrots', '2 sticks of celery', '4 field mushrooms', 'a few sprigs of rosemary', 'olive oil', '1kg quality brisket or stewing beef, cut into 2cm cubes', '440ml Guinness (no lager, please!)', '2 heaped tablespoons plain flour, plus extra for dusting', '140g Cheddar cheese', '170g puff pastry', '1 large egg']",https://www.jamieoliver.com/recipes/beef/steak-guinness-cheese-pie/
713,Squash and ricotta pasta bake,serves 4,1 hr 20 mins,1,"['1 butternut squash, peeled, deseeded and chopped into 2.5cm pieces', 'olive oil', '2 cloves garlic, peeled and finely sliced', '1 bunch fresh basil, leaves picked, stalks finely chopped', '2 x 400g tins of chopped tomatoes', 'sea salt', '500 g dried penne', 'freshly ground black pepper', '3 tablespoons ricotta cheese', '750ml organic vegetable stock', '150 g mozzarella ball', '1 handful Parmesan cheese, freshly grated', '2 sprigs fresh sage, leaves picked']",https://www.jamieoliver.com/recipes/pasta/squash-and-ricotta-pasta-bake/
714,Spring poached chicken,serves 6,1 hr 10 mins,1,"['. 1 x 2kg free-range chicken', '. a handful of fresh flat-leaf parsley', '. 4 fresh bay leaves', '. sea salt and freshly ground black pepper', '. 2 handfuls of new potatoes, scrubbed', '. 2 handfuls of baby carrots', '. 2 handfuls of baby turnips or radishes', '. 1 bulb of fennel, quartered, herby tops removed and reserved', '. freshly grated horseradish', 'optional: 1 jar hot creamed horseradish', '. 285ml of crème fraîche', '. 2 handfuls of fresh peas', '. 2 handfuls of broad beans', '. 1 colanderful of spinach or Swiss chard', '. olive oil', 'optional: small handful of inner celery leaves']",https://www.jamieoliver.com/recipes/chicken/spring-poached-chicken/
715,Spring minestrone,serves 6,45 mins,1,"['6 heaped tablespoons fresh pesto', '1.5 litres organic chicken, ham or vegetable stock', '1 bulb of fennel', '100g fine asparagus', '2 Romanesco cauliflowers or 1 large cauliflower', '6 baby courgettes', '6 ripe plum tomatoes', 'olive oil', '2 cloves of garlic', '1 bunch of spring onions', '200g green and yellow beans', '100g peas', '100g broad beans', '100g spaghetti', '½ a bunch of fresh green or purple basil', '1 small handful of fresh chives', 'extra virgin olive oil']",https://www.jamieoliver.com/recipes/vegetables/spring-minestrone/
716,Spicy pangrattato risotto,serves 8,55 mins,3,"['zest of 1 lemon', '3 dried bird’s-eye chillies', '4 cloves of garlic, peeled', '6 good-quality salted anchovy fillets in oil', '½ a large ciabatta loaf, stale if possible, cut into chunks', 'olive oil', '1 x basic risotto recipe', 'around 700ml organic vegetable or chicken stock', '50g butter', '1 small handful of freshly grated Parmesan cheese, plus extra for grating']",https://www.jamieoliver.com/recipes/rice/spicy-pangrattato-risotto/
717,Spicy lamb cutlets with crispy coriander potatoes,serves 4,1 hr 5 mins,1,"['8 quality lamb cutlets', '4 tablespoons olive oil for the potatoes, plus extra for the lamb', 'sea salt', '1 tablespoon freshly ground black pepper', '1 dried chilli, finely sliced', 'a small handful of fresh thyme leaves', '1kg waxy red potatoes', '2 tablespoons coriander seeds', '½ teaspoon ground cinnamon', 'a small glass of red wine', '1 large cabbage, shredded', 'juice of 1 lemon', 'extra virgin olive oil']",https://www.jamieoliver.com/recipes/lamb/spicy-lamb-cutlets-with-crispy-coriander-potatoes/
718,Spicy barbecued leg of lamb,serves 8,1 hr plus marinating &amp; resting,1,"['3 sticks of lemongrass', '5cm piece of ginger', '5 cloves of garlic', '6 fresh lime leaves', '1 big pinch of ground cumin', '2 lemons', '1 leg of lamb, boned, butterflied – ask your butcher to do this for you', 'a few sprigs of fresh mint', 'fat-free natural yoghurt']",https://www.jamieoliver.com/recipes/lamb/spicy-barbecued-leg-of-lamb/
719,Spiced lamb stew with walnuts and pomegranate,serves 4,2 hrs,1,"['750g quality roasting shoulder joint of lamb, boneless', '2 tablespoons plain flour', 'sea salt and freshly ground black pepper', 'olive oil', '1 red onion, peeled and finely sliced', '4 sticks of celery, trimmed and finely sliced', '4 cloves of garlic, peeled and finely sliced', '½ a stick of cinnamon', '100g walnuts, chopped', '2 bay leaves', '6 pomegranates', 'a bunch of fresh flat-leaf parsley, chopped']",https://www.jamieoliver.com/recipes/lamb/spiced-lamb-stew-with-walnuts-and-pomegranate/
720,Special chicken stew,serves 4,1 hr 40 mins,1,"['salt and freshly ground black pepper', '4 spring chickens or poussins', '1 small handful of fresh parsley, leaves picked, stalks kept', '1 bunch of fresh tarragon, leaves picked, stalks kept', '4 teaspoons wholegrain mustard', '2 heaped tablespoons plain white flour', 'extra virgin olive oil', '1 white onion, peeled and finely chopped', '2 cloves of garlic, peeled and finely sliced', '½ celery heart, trimmed back and finely sliced', '2 good knobs of butter', '2 wineglasses of crisp white wine', '565ml stock', '3 gem lettuces, quartered', '1 small bunch of seedless grapes, washed and halved']",https://www.jamieoliver.com/recipes/chicken/special-chicken-stew/
721,Spaghetti with prawns and rocket (Spaghetti con gamberetti e rucola),serves 4,20 mins,3,"['455g dried spaghetti', '2 cloves garlic', 'extra virgin olive oil', '1-2 dried red chillies', '400g peeled raw prawns, from sustainable sources, ask your fishmonger', '1 small wineglass white wine', '2 heaped tablespoons sun-dried tomato purée, or 6 sun-dried tomatoes blitzed in a blender', '1 lemon', '2 handfuls of rocket']",https://www.jamieoliver.com/recipes/pasta/spaghetti-with-prawns-and-rocket-spaghetti-con-gamberetti-e-rucola/
722,Spaghetti vongole,serves 4,30 mins,3,"['1kg small clams, scrubbed clean, from sustainable sources', '½ a bunch of fresh flat-leaf parsley (15g)', '4 cloves of garlic', '10 cherry tomatoes', '250ml white wine', '400g dried spaghetti', 'extra virgin olive oil', '1–2 dried red chillies']",https://www.jamieoliver.com/recipes/pasta/spaghetti-vongole/
723,Souvlaki (Wicked kebabs),serves 4,1 hr,1,"['3 sweet pointed peppers – a mixture of colours is nice', '8 flatbreads, to serve', '4 sprigs of fresh mint, leaves picked', 'a small bunch of fresh dill, chopped (stalks and all)', 'red wine vinegar', 'Greek extra virgin olive oil', '1 lemon, to serve', '800g higher-welfare leg of pork, shin if you can get it, cut into 2cm chunks', '1 tablespoon dried mint', '1 tablespoon dried oregano', 'juice of 1 lemon', '100ml good-quality olive oil', '2 cloves of garlic, peeled and finely grated', '1 tablespoon red wine vinegar', '½ a large cucumber', '200ml fat free natural yoghurt', '1 small clove of garlic, peeled', '1 heaped teaspoon dried mint', '1½ teaspoons red wine vinegar']",https://www.jamieoliver.com/recipes/pork/souvlaki-wicked-kebabs/
724,Southern-style pork & slaw,serves 10,6 hrs 25 mins,1,"['½ a higher-welfare pork shoulder, neck end with bone in (5kg)', 'olive oil', '2 heaped teaspoons smoked paprika, plus extra for sprinkling', '½ a bunch of fresh mint', '1-2 fresh red chillies', '6 tablespoons olive oil', '3 tablespoons red wine vinegar', '½ a white cabbage', '1 red onion', '3 carrots', '2 big handfuls of collard greens or spring cabbage', '3 crunchy eating apples', '2 tablespoons free-range mayonnaise', 'extra virgin olive oil', 'cayenne pepper', '4-5 tablespoons red wine vinegar']",https://www.jamieoliver.com/recipes/pork/southern-style-pork-slaw/
725,Southern sausage stew,serves 6,1 hr,1,"['olive oil', 'good-quality sausages (about 2 or 3 per person)', '1 onion, peeled and roughly chopped', '1 red pepper, deseeded and roughly chopped', '1 green pepper, deseeded and roughly chopped', '1 yellow pepper, deseeded and roughly chopped', '2 sticks of celery, trimmed and roughly chopped, yellow leaves reserved', '4 cloves of garlic, peeled and chopped', '1–2 fresh red chillies, deseeded and finely chopped', '10 sprigs of fresh thyme, leaves picked', '1 heaped teaspoon paprika', '1 heaped teaspoon cayenne pepper', '2–3 heaped tablespoons plain flour', '1 tablespoon white wine or cider vinegar', '750ml organic chicken stock', '1 x 400g tin of chopped tomatoes', 'cooked long-grain rice, to serve', '3 spring onions, trimmed and finely sliced', 'a small bunch of fresh curly parsley, roughly chopped']",https://www.jamieoliver.com/recipes/pork/southern-sausage-stew/
726,Southern Indian vegetable curry,serves 4,40 mins,1,"['2 fresh green chillies', '2 onions', 'olive oil', '1 teaspoon mustard seeds', '1 bunch of curry leaves', '½ teaspoon ground coriander', '1 pinch of ground cumin', '½ teaspoon garam masala', '¼ teaspoon ground turmeric', '¼ teaspoon chilli powder', '6 ripe tomatoes', '2 sweet potatoes', '2 potatoes', '1 aubergine', '100ml coconut milk', '1 handful of okra', '1 handful of French beans', '1 handful of fresh or frozen peas']",https://www.jamieoliver.com/recipes/vegetables/southern-indian-vegetable-curry-with-curry-leaves/
727,Southern Indian rice and seafood soup,serves 4,50 mins,1,"['5 tablespoons vegetable or sunflower oil', '3 tablespoons brown mustard seeds', 'a handful of fresh curry leaves, picked off their stalks', '2 teaspoons cumin seeds', '1 teaspoon garam masala', '1½ teaspoons chilli powder', '2 teaspoons turmeric', '3 red chillies, deseeded and finely sliced', '2 large thumb-sized pieces of fresh ginger, peeled and grated', '6 cloves of garlic, peeled and finely chopped', '2 onions, peeled and finely chopped', '2 handfuls of basmati rice', '565ml water', '600g fish (see introduction), skinned, filleted and cut into 2–3 inch chunks', '400ml tin of light coconut milk', 'sea salt and freshly ground black pepper', 'juice of 2 limes', 'a handful of fresh coriander, roughly chopped', 'optional: 3 tablespoons freshly grated coconut']",https://www.jamieoliver.com/recipes/fish/southern-indian-rice-and-seafood-soup/
728,South American fishcakes,serves 0,1 hr,1,"['1kg haddock fillets, skin on, scaled and pinboned', '140ml milk', '2 bay leaves', '1kg potatoes, peeled and diced', 'a big bunch of fresh flat-leaf parsley, finely chopped', 'a handful of fresh mint, finely chopped', 'zest of 2 lemons and 2 limes', '1 teaspoon fennel seeds, bashed', '2 large free-range or organic eggs', '1 fresh red chilli, finely chopped', 'sea salt and freshly ground black pepper', '115g plain flour', 'sunflower oil, for deep-frying', 'lemons, to serve']",https://www.jamieoliver.com/recipes/fish/south-american-fishcakes/
